holder,shares,dateReported,change
WEBER ALAN W,10500,2020-12-31,0
BOGLE INVESTMENT MANAGEMENT L P /DE/,9037,2020-12-31,9037
BRINKER CAPITAL INC,19273,2020-06-30,239
TRUEWEALTH LLC,6315,2020-06-30,0
361 CAPITAL LLC,0,2020-06-30,-21716
Xact Kapitalforvaltning AB,8337,2020-03-31,0
"Advisor Group, Inc.",4370,2019-12-31,-592
LADENBURG THALMANN FINANCIAL SERVICES INC.,564,2019-12-31,-41
"FORESTERS INVESTMENT MANAGEMENT COMPANY, INC.",151900,2019-09-30,23100
"BB&T SECURITIES, LLC",29514,2019-09-30,29514
Elkfork Partners LLC,7684,2019-09-30,0
Glen Harbor Capital Management LLC,6328,2019-09-30,0
RIVERHEAD CAPITAL MANAGEMENT LLC,5703,2019-09-30,0
Meadow Creek Investment Management LLC,4972,2019-09-30,0
Flinton Capital Management LLC,3616,2019-09-30,0
MENTA CAPITAL LLC,5429,2019-06-30,-1388
"TEACHERS ADVISORS, LLC",599608,2019-03-31,-4301
DARUMA CAPITAL MANAGEMENT LLC,520316,2019-03-31,-77281
TIAA CREF INVESTMENT MANAGEMENT LLC,354747,2019-03-31,-151
"OppenheimerFunds, Inc.",22360,2019-03-31,-813
"SECOR Capital Advisors, LP",16875,2019-03-31,-51004
"Alpha Quant Advisors, LLC",117,2019-03-31,117
"Kaizen Advisory, LLC",15415,2018-12-31,-2949
BREMER TRUST NATIONAL ASSOCIATION,154,2018-12-31,154
IMPAX ASSET MANAGEMENT LLC,315946,2018-06-30,42800
FNY Managed Accounts LLC,0,2018-03-31,-77
"Delpha Capital Management, LLC",0,2018-03-31,-681
RAINIER INVESTMENT MANAGEMENT LLC,101830,2017-12-31,-3330
"Hutchin Hill Capital, LP",24200,2017-12-31,24200
Numeric Investors LLC,19400,2017-12-31,19400
AHL Partners LLP,17429,2017-12-31,-302
CORNERSTONE CAPITAL MANAGEMENT HOLDINGS LLC.,6100,2017-12-31,6100
"BB&T INVESTMENT SERVICES, INC.",585,2017-12-31,0
Acrospire Investment Management LLC,0,2017-09-30,-875
CAPSTONE ASSET MANAGEMENT CO,9712,2017-06-30,-760
Princeton Alpha Management LP,5565,2017-03-31,5565
BlackRock Fund Advisors,2965958,2016-12-31,444354
"BlackRock Institutional Trust Company, N.A.",1242641,2016-12-31,-33658
BLACKROCK ADVISORS LLC,215471,2016-12-31,-43949
"BlackRock Investment Management, LLC",186652,2016-12-31,32843
BlackRock Group LTD,119067,2016-12-31,25073
MSI Financial Services Inc,10093,2016-12-31,10093
BlackRock Japan Co. Ltd,2009,2016-12-31,-1182
Emerald Acquisition Ltd.,117089,2016-09-30,-253469
"Shinko Asset Management Co., Ltd.",90622,2016-09-30,-39023
"ANALYTIC INVESTORS, LLC",0,2016-09-30,-24946
RUSSELL FRANK CO/,340413,2016-03-31,10810
VIRGINIA RETIREMENT SYSTEM,43300,2016-03-31,43300
"Ada Investment Management, LP",8776,2015-12-31,8776
Santa Fe Partners LLC,8491,2015-12-31,-14679
OFI Advisors LLC,29489,2015-09-30,-7561
MANAGED ACCOUNT ADVISORS LLC,10691,2015-06-30,-401
UBS AG,4975,2014-09-30,1050
"QS BATTERYMARCH FINANCIAL MANAGEMENT, INC",582,2014-09-30,-119321
Wilmington Funds Management Corp,11403,2014-06-30,0
SAC Capital Advisors LP,21046,2014-03-31,-1554
CONNOR CLARK & LUNN INVESTMENT MANAGEMENT LTD,19400,2013-12-31,19400
Irish Life Investment Managers Ltd.,1061,2013-06-30,0
MANULIFE INVESTMENT MANAGEMENT (US) LLC,18211,2013-03-31,447
Manulife Investment Management (North America) Ltd,11530,2013-03-31,981
RBC Dominion Securities Inc.,0,2008-12-31,-213
LEHMAN BROTHERS HOLDINGS INC. PLAN TRUST,67882,2008-06-30,52391
PRUDENTIAL INSURANCE CO OF AMERICA,0,2001-09-30,-11000
