holder,shares,dateReported,change
FMR LLC,24012346,2025-09-30,-897908
JPMORGAN CHASE & CO,23985844,2025-09-30,1344074
"BlackRock, Inc.",20834152,2025-09-30,375191
VANGUARD GROUP INC,13318988,2025-09-30,-31257
WELLINGTON MANAGEMENT GROUP LLP,12583718,2025-09-30,1333920
STATE STREET CORP,10988061,2025-09-30,53261
MASSACHUSETTS FINANCIAL SERVICES CO /MA/,7728322,2025-09-30,-509047
"GEODE CAPITAL MANAGEMENT, LLC",5432952,2025-09-30,-138692
Invesco Ltd.,4755687,2025-09-30,147192
Pictet Asset Management Holding SA,4648607,2025-09-30,94474
BANK OF AMERICA CORP /DE/,4336466,2025-09-30,95185
VAN ECK ASSOCIATES CORP,3832309,2025-09-30,96427
AMERIPRISE FINANCIAL INC,3496081,2025-09-30,-71059
PRICE T ROWE ASSOCIATES INC /MD/,2805181,2025-09-30,-224977
JANUS HENDERSON GROUP PLC,2774811,2025-09-30,65269
ALLIANCEBERNSTEIN L.P.,2497691,2025-09-30,-290616
GOLDMAN SACHS GROUP INC,2450237,2025-09-30,15741
Boston Partners,2439589,2025-09-30,352820
MORGAN STANLEY,2413347,2025-09-30,-294828
DIMENSIONAL FUND ADVISORS LP,2227516,2025-09-30,398250
Legal & General Group Plc,1942012,2025-09-30,72784
NORTHERN TRUST CORP,1903277,2025-09-30,-42121
VAN LANSCHOT KEMPEN INVESTMENT MANAGEMENT N.V.,1869074,2025-09-30,60142
DEUTSCHE BANK AG\,1834898,2025-09-30,-40055
"T. Rowe Price Investment Management, Inc.",1756250,2025-09-30,-384638
BARCLAYS PLC,1736607,2025-09-30,-266554
Amundi,1502735,2025-09-30,-3434
CHARLES SCHWAB INVESTMENT MANAGEMENT INC,1461219,2025-09-30,9557
"Rafferty Asset Management, LLC",1433157,2025-09-30,-483765
RAYMOND JAMES FINANCIAL INC,1407645,2025-09-30,-25335
UBS Group AG,1252968,2025-09-30,-298086
Bank of New York Mellon Corp,1251226,2025-09-30,-51856
"Nuveen, LLC",1190290,2025-09-30,-102225
ROYAL BANK OF CANADA,1185910,2025-09-30,-328101
"SG Americas Securities, LLC",1179129,2025-09-30,889883
VOYA INVESTMENT MANAGEMENT LLC,1116050,2025-09-30,-30392
CITIGROUP INC,1110363,2025-09-30,-47334
FRANKLIN RESOURCES INC,1059356,2025-09-30,-456520
CALIFORNIA PUBLIC EMPLOYEES RETIREMENT SYSTEM,1025166,2025-09-30,112703
LORING WOLCOTT & COOLIDGE FIDUCIARY ADVISORS LLP/MA,971909,2025-09-30,999
"Sumitomo Mitsui Trust Holdings, Inc.",941904,2025-09-30,2220
FIL Ltd,872670,2025-09-30,174459
AVIVA PLC,860223,2025-09-30,313209
FIRST TRUST ADVISORS LP,805172,2025-09-30,-54635
AXA Investment Managers S.A.,801939,2025-09-30,801939
National Pension Service,801609,2025-09-30,15929
"First Pacific Advisors, LP",765060,2025-09-30,170
Swiss National Bank,728229,2025-09-30,-39500
BROWN ADVISORY INC,721935,2025-09-30,7855
NORDEA INVESTMENT MANAGEMENT AB,689579,2025-09-30,46426
Woodline Partners LP,673403,2025-09-30,662950
WELLS FARGO & COMPANY/MN,617679,2025-09-30,20049
CCLA Investment Management,608638,2025-09-30,63058
Artisan Partners Limited Partnership,592719,2025-09-30,9910
"BNP PARIBAS ARBITRAGE, SNC",583049,2025-09-30,-438475
"Mitsubishi UFJ Kokusai Asset Management Co., Ltd.",576662,2025-09-30,25789
"Alyeska Investment Group, L.P.",558629,2025-09-30,-172970
abrdn plc,528194,2025-09-30,91807
"Bridgewater Associates, LP",523933,2025-09-30,358683
HEALTHCARE OF ONTARIO PENSION PLAN TRUST FUND,505822,2025-09-30,-203743
"D. E. Shaw & Co., Inc.",460832,2025-09-30,108082
Man Group plc,458550,2025-09-30,326784
Jefferies Financial Group Inc.,421000,2025-09-30,421000
"NATIXIS ADVISORS, L.P.",398385,2025-09-30,-25202
CANADA PENSION PLAN INVESTMENT BOARD,387059,2025-09-30,69864
MIRAE ASSET GLOBAL ETFS HOLDINGS Ltd.,383469,2025-09-30,19329
CALIFORNIA STATE TEACHERS RETIREMENT SYSTEM,375805,2025-09-30,-1839
ProShare Advisors LLC,350095,2025-09-30,-78404
PUBLIC EMPLOYEES RETIREMENT ASSOCIATION OF COLORADO,341365,2025-09-30,-242894
"Mirae Asset Global Investments Co., Ltd.",338248,2025-09-30,-44483
ENVESTNET ASSET MANAGEMENT INC,337265,2025-09-30,5778
LAZARD ASSET MANAGEMENT LLC,335962,2025-09-30,23443
"Bank Julius Baer & Co. Ltd, Zurich",330520,2025-09-30,6714
GREAT WEST LIFE ASSURANCE CO /CAN/,326870,2025-09-30,-10787
HOMESTEAD ADVISERS CORP,320003,2025-09-30,-6100
BANK OF MONTREAL /CAN/,315552,2025-09-30,61963
Employees Retirement System of Texas,303522,2025-09-30,23800
Andra AP-fonden,299700,2025-09-30,118300
Vontobel Holding Ltd.,294873,2025-09-30,-28411
"Allspring Global Investments Holdings, LLC",293347,2025-09-30,29800
"MARSHALL WACE, LLP",285394,2025-09-30,248735
RHUMBLINE ADVISERS,275953,2025-09-30,8072
PRINCIPAL FINANCIAL GROUP INC,265423,2025-09-30,-3071
TD ASSET MANAGEMENT INC,264839,2025-09-30,-138513
AMERICAN CENTURY COMPANIES INC,263024,2025-09-30,-56696
APG Asset Management N.V.,255897,2025-09-30,-3300
"Russell Investments Group, Ltd.",254827,2025-09-30,39052
TODD ASSET MANAGEMENT LLC,233643,2025-09-30,-23197
"ADAGE CAPITAL PARTNERS GP, L.L.C.",229508,2025-09-30,8100
Janney Montgomery Scott LLC,224033,2025-09-30,-608
LPL Financial LLC,213944,2025-09-30,-5654
AQR CAPITAL MANAGEMENT LLC,213105,2025-09-30,-7420
Tredje AP-fonden,212352,2025-09-30,-16002
ROYAL LONDON ASSET MANAGEMENT LTD,212047,2025-09-30,-1644
CONFLUENCE INVESTMENT MANAGEMENT LLC,210735,2025-09-30,-2263
SCHRODER INVESTMENT MANAGEMENT GROUP,206177,2025-09-30,-3268
Sather Financial Group Inc,205774,2025-09-30,3453
NEW YORK STATE COMMON RETIREMENT FUND,204584,2025-09-30,141455
NEW YORK STATE TEACHERS RETIREMENT SYSTEM,201451,2025-09-30,-3318
"ARGA Investment Management, LP",196620,2025-09-30,-87057
HSBC HOLDINGS PLC,195268,2025-09-30,59199
Mitsubishi UFJ Trust & Banking Corp,189693,2025-09-30,-315
Handelsbanken Fonder AB,189424,2025-09-30,33099
OAK ASSOCIATES LTD /OH/,189345,2025-09-30,-1666
BALYASNY ASSET MANAGEMENT L.P.,188943,2025-09-30,23889
Assenagon Asset Management S.A.,181047,2025-09-30,67151
TEACHERS RETIREMENT SYSTEM OF THE STATE OF KENTUCKY,171270,2025-09-30,-10700
KLINGENSTEIN FIELDS & CO LP,166464,2025-09-30,-45
"PARNASSUS INVESTMENTS, LLC",161077,2025-09-30,161077
LOOMIS SAYLES & CO L P,160443,2025-09-30,4773
Korea Investment CORP,159488,2025-09-30,-8021
"MANUFACTURERS LIFE INSURANCE COMPANY, THE",152594,2025-09-30,2378
Neuberger Berman Group LLC,150014,2025-09-30,-155458
DEPRINCE RACE & ZOLLO INC,149789,2025-09-30,11254
PUBLIC SECTOR PENSION INVESTMENT BOARD,140888,2025-09-30,2704
STATE OF WISCONSIN INVESTMENT BOARD,139083,2025-09-30,1978
"TRILLIUM ASSET MANAGEMENT, LLC",137645,2025-09-30,6121
VICTORY CAPITAL MANAGEMENT INC,135757,2025-09-30,-4345
Meridiem Capital Partners LP,134114,2025-09-30,-5117
Swedbank AB,132817,2025-09-30,-574
"DZ BANK AG Deutsche Zentral Genossenschafts Bank, Frankfurt am Main",131299,2025-09-30,74289
Penserra Capital Management LLC,130768,2025-09-30,41798
"Chevy Chase Trust Holdings, LLC",128665,2025-09-30,-4772
"Sequoia Financial Advisors, LLC",124096,2025-09-30,5662
TRUIST FINANCIAL CORP,121039,2025-09-30,11487
TWINBEECH CAPITAL LP,119031,2025-09-30,55241
"Cardinal Capital Management, Inc.",118542,2025-09-30,2158
Robeco Schweiz AG,117845,2025-09-30,-27555
Zurcher Kantonalbank (Zurich Cantonalbank),114968,2025-09-30,-5614
FACTORY MUTUAL INSURANCE CO,114400,2025-09-30,0
DekaBank Deutsche Girozentrale,112801,2025-09-30,0
"WAYCROSS PARTNERS, LLC",112512,2025-09-30,2476
NEOS Investment Management LLC,108034,2025-09-30,40150
"Asset Management One Co., Ltd.",107235,2025-09-30,3948
DANSKE BANK A/S,106067,2025-09-30,-21582
ING GROEP NV,104850,2025-09-30,22631
FJARDE AP-FONDEN /FOURTH SWEDISH NATIONAL PENSION FUND,104258,2025-09-30,65283
CREDIT AGRICOLE S A,99398,2025-09-30,99398
Mn Services Vermogensbeheer B.V.,96900,2025-09-30,1200
Calamos Advisors LLC,96455,2025-09-30,121
NOMURA ASSET MANAGEMENT CO LTD,96338,2025-09-30,-27597
COOKE & BIELER LP,92282,2025-09-30,-51705
KLP KAPITALFORVALTNING AS,91214,2025-09-30,-700
Sterling Capital Management LLC,90026,2025-09-30,29529
WESTFIELD CAPITAL MANAGEMENT CO LP,89996,2025-09-30,89996
MACQUARIE GROUP LTD,89478,2025-09-30,5095
State of New Jersey Common Pension Fund D,86755,2025-09-30,3054
Crestwood Advisors Group LLC,83240,2025-09-30,-2
"Smith, Salley & Associates",83144,2025-09-30,-1125
"SUSQUEHANNA INTERNATIONAL GROUP, LLP",82285,2025-09-30,35774
SHELTON CAPITAL MANAGEMENT,81293,2025-09-30,-2085
Daiwa Securities Group Inc.,80890,2025-09-30,12988
"CSM Advisors, LLC",80658,2025-09-30,80658
STATE OF MICHIGAN RETIREMENT SYSTEM,80268,2025-09-30,-500
Squarepoint Ops LLC,79486,2025-09-30,-76829
MARCO INVESTMENT MANAGEMENT LLC,78424,2025-09-30,1282
Cetera Investment Advisers,77980,2025-09-30,16420
SORA INVESTORS LLC,77201,2025-09-30,77201
Glenview Trust Co,76646,2025-09-30,6337
STIFEL FINANCIAL CORP,75593,2025-09-30,3820
"HighTower Advisors, LLC",75569,2025-09-30,-4039
Arizona State Retirement System,73777,2025-09-30,-291
GDS Wealth Management,72938,2025-09-30,3141
"PNC FINANCIAL SERVICES GROUP, INC.",72143,2025-09-30,724
"ADVISOR GROUP HOLDINGS, INC.",71600,2025-09-30,1213
J. Safra Sarasin Holding AG,70883,2025-09-30,1269
CIBC Asset Management Inc,70354,2025-09-30,-26
STEPHENS INC /AR/,69168,2025-09-30,4161
"Ensign Peak Advisors, Inc",68321,2025-09-30,-32546
"Resona Asset Management Co.,Ltd.",67645,2025-09-30,-5151
"State of Tennessee, Treasury Department",66795,2025-09-30,13190
Jain Global LLC,64967,2025-09-30,-36627
Czech National Bank,64032,2025-09-30,2281
Varma Mutual Pension Insurance Co,63544,2025-09-30,5100
SEI INVESTMENTS CO,62546,2025-09-30,-2518
Polar Asset Management Partners Inc.,61460,2025-09-30,61460
MACKENZIE FINANCIAL CORP,60699,2025-09-30,39195
Carmel Capital Management L.L.C.,60652,2025-09-30,2075
COMMONWEALTH OF PENNSYLVANIA PUBLIC SCHOOL EMPLS RETRMT SYS,60542,2025-09-30,-1417
BNP Paribas Asset Management Holding S.A.,59927,2025-09-30,776
Quantinno Capital Management LP,59149,2025-09-30,14145
"MetLife Investment Management, LLC",58348,2025-09-30,-1812
CITADEL ADVISORS LLC,58169,2025-09-30,-113209
"OSBORNE PARTNERS CAPITAL MANAGEMENT, LLC",57728,2025-09-30,-342
"Crossmark Global Holdings, Inc.",57440,2025-09-30,-1088
Lansforsakringar Fondforvaltning AB (publ),57246,2025-09-30,3891
FORSTA AP-FONDEN,56500,2025-09-30,3100
"Steward Partners Investment Advisory, LLC",55291,2025-09-30,-945
OMERS ADMINISTRATION Corp,53789,2025-09-30,-4856
Retirement Systems of Alabama,53780,2025-09-30,-429
La Banque Postale Asset Management SA,52888,2025-09-30,4538
JB Capital LLC,52263,2025-09-30,-8239
"Telos Capital Management, Inc.",51464,2025-09-30,362
SKBA CAPITAL MANAGEMENT LLC,51189,2025-09-30,500
Engineers Gate Manager LP,50698,2025-09-30,-70654
NOMURA HOLDINGS INC,50472,2025-09-30,43477
GF FUND MANAGEMENT CO. LTD.,50314,2025-09-30,0
"Nearwater Capital Markets, Ltd",50000,2025-09-30,50000
Walleye Capital LLC,49887,2025-09-30,-64078
PINNACLE ASSOCIATES LTD,49628,2025-09-30,162
"KINGDON CAPITAL MANAGEMENT, L.L.C.",47500,2025-09-30,47500
DnB Asset Management AS,46968,2025-09-30,911
USS Investment Management Ltd,45993,2025-09-30,0
Nemes Rush Group LLC,45922,2025-09-30,848
Guinness Asset Management LTD,44578,2025-09-30,44578
Creative Planning,44319,2025-09-30,-1611
"COMMONWEALTH EQUITY SERVICES, LLC",44275,2025-09-30,-3889
"KETTLE HILL CAPITAL MANAGEMENT, LLC",43590,2025-09-30,54
"ASSETMARK, INC",43337,2025-09-30,2365
"Pacer Advisors, Inc.",43294,2025-09-30,-1927
"THOMPSON INVESTMENT MANAGEMENT, INC.",42969,2025-09-30,-949
IQ EQ FUND MANAGEMENT (IRELAND) Ltd,42443,2025-09-30,4125
"Toroso Investments, LLC",42314,2025-09-30,9509
Zweig-DiMenna Associates LLC,41969,2025-09-30,-4531
Allianz Asset Management GmbH,41042,2025-09-30,-1141
"Baird Financial Group, Inc.",40960,2025-09-30,20253
"Foster Victor Wealth Advisors, LLC",40692,2025-09-30,1050
Renaissance Investment Group LLC,40364,2025-09-30,-4941
Altrius Capital Management Inc,40220,2025-09-30,-3205
Mediolanum International Funds Ltd,39407,2025-09-30,-12415
TEACHER RETIREMENT SYSTEM OF TEXAS,38987,2025-09-30,-5467
NEW YORK LIFE INVESTMENT MANAGEMENT LLC,38635,2025-09-30,-122
CIBC WORLD MARKET INC.,38543,2025-09-30,28751
HITE Hedge Asset Management LLC,37674,2025-09-30,10368
MILLENNIUM MANAGEMENT LLC,37613,2025-09-30,-37592
BRITISH COLUMBIA INVESTMENT MANAGEMENT Corp,36308,2025-09-30,-3595
Raiffeisen Bank International AG,36152,2025-09-30,-1596
PRUDENTIAL PLC,35614,2025-09-30,-331
AMALGAMATED BANK,35179,2025-09-30,-620
PROFUND ADVISORS LLC,35135,2025-09-30,283
"Gibraltar Capital Management, Inc.",34384,2025-09-30,-1670
THRIVENT FINANCIAL FOR LUTHERANS,34211,2025-09-30,22119
"Vantage Investment Partners, LLC",34193,2025-09-30,0
Morningstar Investment Management LLC,33905,2025-09-30,32570
"WEALTH ENHANCEMENT ADVISORY SERVICES, LLC",33718,2025-09-30,-2535
"Colony Group, LLC",33452,2025-09-30,-2446
PRUDENTIAL FINANCIAL INC,33405,2025-09-30,303
"WILEY BROS.-AINTREE CAPITAL, LLC",33381,2025-09-30,-16433
"FourThought Financial Partners, LLC",33238,2025-09-30,500
Tufton Capital Management,33129,2025-09-30,-340
"O'SHAUGHNESSY ASSET MANAGEMENT, LLC",32956,2025-09-30,2716
Cerity Partners LLC,31697,2025-09-30,-1029
"CI Private Wealth, LLC",31676,2025-09-30,1245
Louisiana State Employees Retirement System,31600,2025-09-30,-200
MOTCO,31485,2025-09-30,118
"Lido Advisors, LLC",31467,2025-09-30,11232
"Sumitomo Mitsui DS Asset Management Company, Ltd",31169,2025-09-30,222
"Financiere des Professionnels - Fonds d,investissement inc.",30414,2025-09-30,-1656
iA Global Asset Management Inc.,30131,2025-09-30,1179
MUTUAL OF AMERICA CAPITAL MANAGEMENT LLC,30091,2025-09-30,-1642
Grand Alliance Asset Management Ltd,30000,2025-09-30,30000
BANK OF NOVA SCOTIA,29854,2025-09-30,-263
"Pensionmark Financial Group, LLC",29754,2025-09-30,-2170
"Brinker Capital Investments, LLC",29255,2025-09-30,-5021
GAM Holding AG,29167,2025-09-30,-286
Schonfeld Strategic Advisors LLC,28845,2025-09-30,-60713
"YOUSIF CAPITAL MANAGEMENT, LLC",28823,2025-09-30,-1760
OREGON PUBLIC EMPLOYEES RETIREMENT FUND,28743,2025-09-30,6933
"Martin Investment Management, LLC",28336,2025-09-30,-935
Utah Retirement Systems,28306,2025-09-30,-264
US BANCORP \DE\,28290,2025-09-30,-34
"Nikko Asset Management Americas, Inc.",28105,2025-09-30,-2927
"Strategic Global Advisors, LLC",28007,2025-09-30,-48
"Mariner, LLC",27514,2025-09-30,-4246
BRANT POINT INVESTMENT MANAGEMENT LLC,27431,2025-09-30,616
LYRICAL ASSET MANAGEMENT LP,27363,2025-09-30,598
"State of Alaska, Department of Revenue",26994,2025-09-30,-1459
FineMark National Bank & Trust,26868,2025-09-30,43
Oliver Luxxe Assets LLC,26767,2025-09-30,26767
Integrated Advisors Network LLC,26668,2025-09-30,6879
JACOBS & CO/CA,26455,2025-09-30,725
"XPONANCE, INC.",26001,2025-09-30,-804
DAVENPORT & Co LLC,25214,2025-09-30,4908
"LIGHT STREET CAPITAL MANAGEMENT, LLC",25179,2025-09-30,2289
RENAISSANCE GROUP LLC,24932,2025-09-30,-130
"LRI Investments, LLC",24584,2025-09-30,0
Adviser Investments LLC,24380,2025-09-30,24380
MERCER GLOBAL ADVISORS INC /ADV,24356,2025-09-30,8772
Polar Capital Holdings Plc,24200,2025-09-30,-21100
"Empowered Funds, LLC",23975,2025-09-30,8645
Generate Investment Management Ltd,23706,2025-09-30,-16280
Banque Cantonale Vaudoise,23693,2025-09-30,-1176
Fiera Capital Corp,23343,2025-09-30,2714
Taikang Asset Management (Hong Kong) Co Ltd,23083,2025-09-30,-5874
South Dakota Investment Council,23020,2025-09-30,-488
Arosa Capital Management LP,23000,2025-09-30,-1000
"VOLORIDGE INVESTMENT MANAGEMENT, LLC",22898,2025-09-30,22898
Avanza Fonder AB,22650,2025-09-30,404
Alberta Investment Management Corp,22600,2025-09-30,6400
CAPTRUST FINANCIAL ADVISORS,22509,2025-09-30,82
NEW ENGLAND ASSET MANAGEMENT INC,21835,2025-09-30,130
"Vident Advisory, LLC",21538,2025-09-30,5449
NORTHWESTERN MUTUAL WEALTH MANAGEMENT CO,21369,2025-09-30,696
Elo Mutual Pension Insurance Co,21139,2025-09-30,5658
"Meridian Wealth Advisors, LLC",20905,2025-09-30,1690
"L. Roy Papp & Associates, LLP",20498,2025-09-30,-802
Groupe la Francaise,20494,2025-09-30,17218
"Gotham Asset Management, LLC",20479,2025-09-30,15154
FIFTH THIRD BANCORP,20365,2025-09-30,-299
Robeco Institutional Asset Management B.V.,20210,2025-09-30,2903
"Norinchukin Bank, The",20184,2025-09-30,-67
"CWA Asset Management Group, LLC",20101,2025-09-30,-461
CAMBIAR INVESTORS LLC,20036,2025-09-30,-9538
JONES FINANCIAL COMPANIES LLLP,19902,2025-09-30,1251
Mendel Money Management,19817,2025-09-30,-319
Snowden Capital Advisors LLC,19207,2025-09-30,545
"Grantham, Mayo, Van Otterloo & Co. LLC",18634,2025-09-30,14155
"American Trust Investment Advisors, LLC",18575,2025-09-30,-386
Truvestments Capital LLC,18482,2025-09-30,-2251
Atlantic Union Bankshares Corp,18436,2025-09-30,-633
ZEVENBERGEN CAPITAL INVESTMENTS LLC,18400,2025-09-30,7500
MIZUHO SECURITIES USA LLC,18362,2025-09-30,907
MANNING & NAPIER ADVISORS LLC,18184,2025-09-30,-1637
"Vanguard Personalized Indexing Management, LLC",18104,2025-09-30,100
ASR Vermogensbeheer N.V.,18091,2025-09-30,-13
HUNTER ASSOCIATES INVESTMENT MANAGEMENT LLC,18010,2025-09-30,0
NOVEM GROUP,17799,2025-09-30,161
Act Two Investors LLC,17565,2025-09-30,-27455
"Qsemble Capital Management, LP",17402,2025-09-30,11890
"Stanley-Laman Group, Ltd.",17177,2025-09-30,-895
"Long Run Wealth Advisors, LLC",17053,2025-09-30,-412
"Freestone Capital Holdings, LLC",16834,2025-09-30,-27
OCCUDO QUANTITATIVE STRATEGIES LP,16601,2025-09-30,-5643
"Atria Investments, Inc",16572,2025-09-30,845
"Lifeworks Advisors, LLC",16536,2025-09-30,3074
"180 WEALTH ADVISORS, LLC",16522,2025-09-30,773
"Pathstone Holdings, LLC",16339,2025-09-30,-597
"WealthShield Partners, LLC",16210,2025-09-30,3116
Investment Management Corp of Ontario,16184,2025-09-30,1124
Rockefeller Capital Management L.P.,16102,2025-09-30,-2239
"Harvest Fund Management Co., Ltd",15482,2025-09-30,1139
"FINANCIAL ADVISORY PARTNERS, LLC",15328,2025-09-30,-296
"RBA Wealth Management, LLC",15190,2025-09-30,525
STATE BOARD OF ADMINISTRATION OF FLORIDA RETIREMENT SYSTEM,15049,2025-09-30,60
Ethic Inc.,14986,2025-09-30,-2114
"KESTRA PRIVATE WEALTH SERVICES, LLC",14944,2025-09-30,346
DARK FOREST CAPITAL MANAGEMENT LP,14900,2025-09-30,0
Seascape Capital Management,14859,2025-09-30,459
HARTFORD INVESTMENT MANAGEMENT CO,14780,2025-09-30,-457
Federation des caisses Desjardins du Quebec,14707,2025-09-30,1542
Estabrook Capital Management,14680,2025-09-30,-160
"Twin Tree Management, LP",14479,2025-09-30,14479
"Watchman Group, Inc.",14085,2025-09-30,-437
ALERUS FINANCIAL  NA,14060,2025-09-30,14060
"NBC SECURITIES, INC.",13993,2025-09-30,193
EFG Asset Management (North America) Corp.,13813,2025-09-30,42
"Concurrent Investment Advisors, LLC",13522,2025-09-30,208
"JANE STREET GROUP, LLC",13415,2025-09-30,12199
SEMPER AUGUSTUS INVESTMENTS GROUP LLC,13394,2025-09-30,-164
"Financial Advisors Network, Inc.",13308,2025-09-30,22
CARY STREET PARTNERS FINANCIAL LLC,13290,2025-09-30,-449
LOGAN CAPITAL MANAGEMENT INC,13277,2025-09-30,-44
"Williams Jones Wealth Management, LLC.",13016,2025-09-30,-25
"Kestra Advisory Services, LLC",12912,2025-09-30,-1953
Gulf International Bank (UK) Ltd,12747,2025-09-30,-144
"MML INVESTORS SERVICES, LLC",12717,2025-09-30,-427
"CULLEN INVESTMENT GROUP, LTD.",12675,2025-09-30,772
FIGURE 8 INVESTMENT STRATEGIES LLC,12524,2025-09-30,-1015
"WEST MICHIGAN ADVISORS, LLC",12506,2025-09-30,10796
"CWM, LLC",12495,2025-09-30,3376
"Metis Global Partners, LLC",12483,2025-09-30,-412
"Advisory Services Network, LLC",12408,2025-09-30,31
Prospera Financial Services Inc,12367,2025-09-30,-1088
"Dai-Ichi Life Insurance Company, Ltd",12305,2025-09-30,0
Generali Asset Management SPA SGR,12258,2025-09-30,288
Vinva Investment Management Ltd,12144,2025-09-30,2075
"SECURIAN ASSET MANAGEMENT, INC",12110,2025-09-30,-1074
FCA CORP /TX,12108,2025-09-30,-9
"L2 Asset Management, LLC",12089,2025-09-30,1713
Shorepoint Capital Partners LLC,12033,2025-09-30,12033
"Kinneret Advisory, LLC",11837,2025-09-30,-53
GATEWAY INVESTMENT ADVISERS LLC,11691,2025-09-30,-2388
"Holocene Advisors, LP",11691,2025-09-30,11691
Verition Fund Management LLC,11581,2025-09-30,-94
MCCARTER PRIVATE WEALTH SERVICES LLC,11470,2025-09-30,-584
GUGGENHEIM CAPITAL LLC,11435,2025-09-30,866
NEW MEXICO EDUCATIONAL RETIREMENT BOARD,11400,2025-09-30,-500
"LEVEL FOUR ADVISORY SERVICES, LLC",11377,2025-09-30,412
ALLIANZ SE,11333,2025-09-30,2502
INTECH INVESTMENT MANAGEMENT LLC,11331,2025-09-30,3389
CENTRAL BANK & TRUST CO,11317,2025-09-30,244
"Comprehensive Financial Consultants Institutional, Inc.",11203,2025-09-30,323
Zurich Insurance Group Ltd/FI,11050,2025-09-30,11050
"Private Advisor Group, LLC",11021,2025-09-30,562
"Inspire Investing, LLC",10993,2025-09-30,57
"Advisors Asset Management, Inc.",10905,2025-09-30,-1068
"Cambridge Investment Research Advisors, Inc.",10891,2025-09-30,-715
"Global X Japan Co., Ltd.",10751,2025-09-30,-4932
"Ameritas Investment Partners, Inc.",10706,2025-09-30,45
"Leeward Financial Partners, LLC",10679,2025-09-30,1049
Codex Capital Asset Management L.L.C.,10500,2025-09-30,0
GTS SECURITIES LLC,10450,2025-09-30,8580
"Morse Asset Management, Inc",10250,2025-09-30,-895
"NISA INVESTMENT ADVISORS, LLC",10230,2025-09-30,1657
AZZAD ASSET MANAGEMENT INC /ADV,10020,2025-09-30,430
"NewEdge Advisors, LLC",10010,2025-09-30,2058
INTREPID FAMILY OFFICE LLC,10000,2025-09-30,0
PRINCETON CAPITAL MANAGEMENT LLC,9890,2025-09-30,-1856
"Nova R Wealth, Inc.",9788,2025-09-30,-75
"Summit Trail Advisors, LLC",9604,2025-09-30,7205
"Cove Private Wealth, LLC",9538,2025-09-30,0
"CBOE Vest Financial, LLC",9499,2025-09-30,1726
"American Money Management, LLC",9380,2025-09-30,-66
EAGLE GLOBAL ADVISORS LLC,9368,2025-09-30,0
Campbell & CO Investment Adviser LLC,9359,2025-09-30,-15463
ALLSTATE CORP,9330,2025-09-30,9330
"Horizon Investments, LLC",9226,2025-09-30,2799
K.J. Harrison & Partners Inc,9205,2025-09-30,9205
"Drum Hill Capital, LLC",9139,2025-09-30,0
BALLAST ADVISORS LLC,8928,2025-09-30,89
ODDO BHF ASSET MANAGEMENT SAS,8898,2025-09-30,-1388
"Koss-Olinger Consulting, LLC",8832,2025-09-30,-11
GARDNER LEWIS ASSET MANAGEMENT L P,8793,2025-09-30,1786
"Kovitz Investment Group Partners, LLC",8740,2025-09-30,-59
GABELLI FUNDS LLC,8700,2025-09-30,-154
"LifePlan Financial, LLC",8600,2025-09-30,1135
M&G Plc,8543,2025-09-30,0
HANCOCK WHITNEY CORP,8513,2025-09-30,436
MGO ONE SEVEN LLC,8511,2025-09-30,6436
"SAGESPRING WEALTH PARTNERS, LLC",8476,2025-09-30,-295
Cardinal Capital Management,8416,2025-09-30,104
TOKIO MARINE ASSET MANAGEMENT CO LTD,8376,2025-09-30,217
Magnetar Financial LLC,8207,2025-09-30,8207
"Mengis Capital Management, Inc.",8180,2025-09-30,0
ACADIAN ASSET MANAGEMENT LLC,8039,2025-09-30,8039
AE Wealth Management LLC,8024,2025-09-30,2116
M&T BANK CORP,8000,2025-09-30,-1945
PUBLIC EMPLOYEES RETIREMENT SYSTEM OF OHIO,7894,2025-09-30,0
APG Asset Management US Inc.,7850,2025-09-30,0
Berkshire Bank,7735,2025-09-30,-205
LONDON CO OF VIRGINIA,7716,2025-09-30,4982
UBS ASSET MANAGEMENT AMERICAS INC,7698,2025-09-30,-3320562
"CALIBER WEALTH MANAGEMENT, LLC / KS",7697,2025-09-30,-231
PARK AVENUE SECURITIES LLC,7695,2025-09-30,-1994
Machina Capital S.A.S.,7677,2025-09-30,7677
EQUITABLE TRUST CO,7650,2025-09-30,-10
"Madison Asset Management, LLC",7634,2025-09-30,-151
REGIONS FINANCIAL CORP,7607,2025-09-30,-366
Integrated Wealth Concepts LLC,7568,2025-09-30,172
PITCAIRN CO,7537,2025-09-30,-2073
D.A. DAVIDSON & CO.,7438,2025-09-30,-1431
"Strategic Financial Services, Inc,",7336,2025-09-30,-186
HM PAYSON & CO,7254,2025-09-30,-238
"Evercore Wealth Management, LLC",7204,2025-09-30,-633
"Midwest Professional Planners, LTD.",7073,2025-09-30,24
"Nordwand Advisors, LLC",7050,2025-09-30,0
KAYNE ANDERSON RUDNICK INVESTMENT MANAGEMENT LLC,7050,2025-09-30,2596
"Legacy Bridge, LLC",7041,2025-09-30,0
Krane Funds Advisors LLC,7018,2025-09-30,5967
CAPITAL ADVISORS INC/OK,6989,2025-09-30,-1006
COMMERCE BANK,6962,2025-09-30,-375
Wahed Invest LLC,6957,2025-09-30,42
"Financial Management Professionals, Inc.",6861,2025-09-30,1319
"Round Rock Advisors, LLC",6802,2025-09-30,51
MUFG SECURITIES AMERICAS INC.,6799,2025-09-30,1200
Eisler Capital Management Ltd.,6703,2025-09-30,-3097
"Reynders McVeigh Capital Management, LLC",6686,2025-09-30,-160
"China Universal Asset Management Co., Ltd.",6656,2025-09-30,920
COOKSON PEIRCE & CO INC,6648,2025-09-30,29
"HB Wealth Management, LLC",6636,2025-09-30,159
First Bank & Trust,6528,2025-09-30,-1
Hartford Funds Management Co LLC,6310,2025-09-30,1323
RNC CAPITAL MANAGEMENT LLC,6285,2025-09-30,-76
"Alpha Cubed Investments, LLC",6281,2025-09-30,-28
WINTON GROUP Ltd,6251,2025-09-30,3439
"Savant Capital, LLC",6105,2025-09-30,184
"Invera Wealth Advisors, LLC",6104,2025-09-30,56
TUDOR INVESTMENT CORP ET AL,6028,2025-09-30,-33707
"Clearstead Trust, LLC",6000,2025-09-30,0
MONTAG A & ASSOCIATES INC,5987,2025-09-30,0
Independent Advisor Alliance,5969,2025-09-30,165
Bowman & Co S.C.,5958,2025-09-30,-46
Wealthfront Advisers LLC,5940,2025-09-30,1121
"Dynasty Wealth Management, LLC",5919,2025-09-30,4105
"Beaumont Financial Advisors, LLC",5914,2025-09-30,16
"HIGHLAND CAPITAL MANAGEMENT, LLC",5816,2025-09-30,5816
"HARBOR INVESTMENT ADVISORY, LLC",5776,2025-09-30,523
Fisher Funds Management LTD,5775,2025-09-30,5775
BURNEY CO/,5755,2025-09-30,-1122
BOURGEON CAPITAL MANAGEMENT LLC,5751,2025-09-30,5751
Marshall Financial Group LLC,5703,2025-09-30,153
CONGRESS ASSET MANAGEMENT CO /MA,5677,2025-09-30,-1006
"Meeder Advisory Services, Inc.",5673,2025-09-30,852
"Prospect Hill Management, LLC",5600,2025-09-30,-435
Sowell Financial Services LLC,5449,2025-09-30,549
"ABLE Financial Group, LLC",5423,2025-09-30,-105
"Philip James Wealth Mangement, LLC",5394,2025-09-30,-693
"Sound View Wealth Advisors Group, LLC",5378,2025-09-30,126
Howard Capital Management Inc.,5378,2025-09-30,-62
"THOROUGHBRED FINANCIAL SERVICES, LLC",5346,2025-09-30,-275
"CIBC Private Wealth Group, LLC",5316,2025-09-30,842
